{
  "url" : "https://github.com/assertj/assertj/pull/2592",
  "project" : "assertj",
  "breakingCommit" : "0c5dfb9213f034cda91aca4941bbe218ffcf93fc",
  "prAuthor" : "bot",
  "preCommitAuthor" : "human",
  "breakingCommitAuthor" : "bot",
  "updatedDependency" : {
    "dependencyGroupID" : "org.jboss.logging",
    "dependencyArtifactID" : "jboss-logging",
    "previousVersion" : "3.4.3.Final",
    "newVersion" : "3.5.0.Final",
    "dependencyScope" : "compile",
    "versionUpdateType" : "other"
  }
}