{
  "url": "https://github.com/jcabi/jcabi-http/pull/383",
  "project": "jcabi-http",
  "breakingCommit": "5a3f3fd7d7b10d5978f17b58569e005946a49e88",
  "prAuthor": "bot",
  "preCommitAuthor": "bot",
  "breakingCommitAuthor": "bot",
  "updatedDependency": {
    "dependencyGroupID": "com.fasterxml.jackson.core",
    "dependencyArtifactID": "jackson-databind",
    "previousVersion": "2.13.4.2",
    "newVersion": "2.14.0",
    "dependencyScope": "provided",
    "versionUpdateType": "other"
  }
}