{
  "url" : "https://github.com/osgi/osgi.enroute/pull/190",
  "project" : "osgi.enroute",
  "breakingCommit" : "e75adbd924119f077dae19a2858866528a9702ef",
  "prAuthor" : "bot",
  "preCommitAuthor" : "human",
  "breakingCommitAuthor" : "bot",
  "updatedDependency" : {
    "dependencyGroupID" : "ch.qos.logback",
    "dependencyArtifactID" : "logback-core",
    "previousVersion" : "1.2.3",
    "newVersion" : "1.2.9",
    "dependencyScope" : "runtime",
    "versionUpdateType" : "patch"
  }
}