{
  "url": "https://github.com/jenkinsci/sloccount-plugin/pull/101",
  "project": "sloccount-plugin",
  "breakingCommit": "6a96a3c8ab6523e9876ee49fdac32b494cdca4b3",
  "prAuthor": "bot",
  "preCommitAuthor": "bot",
  "breakingCommitAuthor": "bot",
  "updatedDependency": {
    "dependencyGroupID": "io.jenkins.tools.bom",
    "dependencyArtifactID": "bom-2.332.x",
    "previousVersion": "1643.v1cffef51df73",
    "newVersion": "1763.v092b_8980a_f5e",
    "dependencyScope": "import",
    "versionUpdateType": "other"
  }
}