{
  "url" : "https://github.com/cmu-db/benchbase/pull/170",
  "project" : "benchbase",
  "breakingCommit" : "3e9f19af03b042bd4759873555910d8e2c737b46",
  "prAuthor" : "bot",
  "preCommitAuthor" : "bot",
  "breakingCommitAuthor" : "bot",
  "updatedDependency" : {
    "dependencyGroupID" : "com.google.cloud",
    "dependencyArtifactID" : "google-cloud-spanner-jdbc",
    "previousVersion" : "2.6.1",
    "newVersion" : "2.7.1",
    "dependencyScope" : "compile",
    "versionUpdateType" : "minor"
  }
}