{
  "url" : "https://github.com/chocoteam/choco-solver/pull/1020",
  "project" : "choco-solver",
  "breakingCommit" : "1d92f77982f7d2adab96e4352f9544e5d8597127",
  "prAuthor" : "bot",
  "preCommitAuthor" : "human",
  "breakingCommitAuthor" : "bot",
  "updatedDependency" : {
    "dependencyGroupID" : "com.puppycrawl.tools",
    "dependencyArtifactID" : "checkstyle",
    "previousVersion" : "10.6.0",
    "newVersion" : "10.9.1",
    "dependencyScope" : "compile",
    "versionUpdateType" : "minor"
  }
}