{
  "url" : "https://github.com/microsoftgraph/msgraph-sdk-java-core/pull/563",
  "project" : "msgraph-sdk-java-core",
  "breakingCommit" : "da7293058de2eaff9fd9d6b6fc226907d3c615e5",
  "prAuthor" : "bot",
  "preCommitAuthor" : "human",
  "breakingCommitAuthor" : "bot",
  "updatedDependency" : {
    "dependencyGroupID" : "com.azure",
    "dependencyArtifactID" : "azure-core",
    "previousVersion" : "1.29.1",
    "newVersion" : "1.30.0",
    "dependencyScope" : "compile",
    "versionUpdateType" : "minor"
  }
}