{
  "url": "https://github.com/informatici/openhospital-core/pull/422",
  "project": "openhospital-core",
  "breakingCommit": "bf0f5b998ec7093d8ddd131ea399b4eb5b7767f3",
  "prAuthor": "bot",
  "preCommitAuthor": "bot",
  "breakingCommitAuthor": "bot",
  "updatedDependency": {
    "dependencyGroupID": "mysql",
    "dependencyArtifactID": "mysql-connector-java",
    "previousVersion": "5.1.14",
    "newVersion": "8.0.25",
    "dependencyScope": "compile",
    "versionUpdateType": "major"
  }
}