{
  "url": "https://github.com/jcabi/jcabi-github/pull/1603",
  "project": "jcabi-github",
  "breakingCommit": "54e776ddb0ce16f5317a6c2feec640a831b039bb",
  "prAuthor": "bot",
  "preCommitAuthor": "bot",
  "breakingCommitAuthor": "bot",
  "updatedDependency": {
    "dependencyGroupID": "com.jcabi",
    "dependencyArtifactID": "jcabi-xml",
    "previousVersion": "0.27.0",
    "newVersion": "0.27.1",
    "dependencyScope": "compile",
    "versionUpdateType": "patch"
  }
}