{
  "url" : "https://github.com/querydsl/querydsl/pull/3220",
  "project" : "querydsl",
  "breakingCommit" : "0cfac3c0ec4f71ed73a7f88a128e4c3913bee8ec",
  "prAuthor" : "bot",
  "preCommitAuthor" : "human",
  "breakingCommitAuthor" : "bot",
  "updatedDependency" : {
    "dependencyGroupID" : "com.puppycrawl.tools",
    "dependencyArtifactID" : "checkstyle",
    "previousVersion" : "9.3",
    "newVersion" : "10.1",
    "dependencyScope" : "compile",
    "versionUpdateType" : "major"
  }
}