{
  "url" : "https://github.com/paulcwarren/spring-content/pull/1303",
  "project" : "spring-content",
  "breakingCommit" : "ffaecf0b1c1bcee783da13ae6d9e52a03f4c9853",
  "prAuthor" : "bot",
  "preCommitAuthor" : "human",
  "breakingCommitAuthor" : "bot",
  "updatedDependency" : {
    "dependencyGroupID" : "software.amazon.awssdk",
    "dependencyArtifactID" : "s3",
    "previousVersion" : "2.17.289",
    "newVersion" : "2.20.22",
    "dependencyScope" : "compile",
    "versionUpdateType" : "minor"
  }
}