{
  "url" : "https://github.com/paulcwarren/spring-content-examples/pull/554",
  "project" : "spring-content-examples",
  "breakingCommit" : "b25e4a1fffc801f51863affd3a46912839b60b71",
  "prAuthor" : "bot",
  "preCommitAuthor" : "human",
  "breakingCommitAuthor" : "bot",
  "updatedDependency" : {
    "dependencyGroupID" : "software.amazon.awssdk",
    "dependencyArtifactID" : "netty-nio-client",
    "previousVersion" : "2.17.182",
    "newVersion" : "2.17.242",
    "dependencyScope" : "compile",
    "versionUpdateType" : "patch"
  }
}