{
  "url" : "https://github.com/smallrye/smallrye-stork/pull/454",
  "project" : "smallrye-stork",
  "breakingCommit" : "8d7dcb490a8c4436889b4a9284006171118f696c",
  "prAuthor" : "bot",
  "preCommitAuthor" : "human",
  "breakingCommitAuthor" : "bot",
  "updatedDependency" : {
    "dependencyGroupID" : "org.springframework",
    "dependencyArtifactID" : "spring-framework-bom",
    "previousVersion" : "5.3.24",
    "newVersion" : "6.0.4",
    "dependencyScope" : "import",
    "versionUpdateType" : "major"
  }
}