{
  "url" : "https://github.com/ingef/conquery/pull/2646",
  "project" : "conquery",
  "breakingCommit" : "7023d8f1e9d9d4264acfbbd563c02b456c09c9f2",
  "prAuthor" : "bot",
  "preCommitAuthor" : "human",
  "breakingCommitAuthor" : "bot",
  "updatedDependency" : {
    "dependencyGroupID" : "com.github.javaparser",
    "dependencyArtifactID" : "javaparser-symbol-solver-core",
    "previousVersion" : "3.23.1",
    "newVersion" : "3.24.4",
    "dependencyScope" : "compile",
    "versionUpdateType" : "minor"
  }
}