{
  "url": "https://github.com/javaparser/javaparser/pull/4089",
  "project": "javaparser",
  "breakingCommit": "3e574764131a426d47f2891c755bb8c7d1f5be68",
  "prAuthor": "bot",
  "preCommitAuthor": "human",
  "breakingCommitAuthor": "bot",
  "updatedDependency": {
    "dependencyGroupID": "com.google.guava",
    "dependencyArtifactID": "guava",
    "previousVersion": "32.1.0-jre",
    "newVersion": "32.1.1-jre",
    "dependencyScope": "compile",
    "versionUpdateType": "other"
  }
}