{
  "url": "https://github.com/googleapis/java-logging-logback/pull/523",
  "project": "java-logging-logback",
  "breakingCommit": "b30d00a13b43d3346518c82cbfaf8b16baed7b1b",
  "prAuthor": "bot",
  "preCommitAuthor": "bot",
  "breakingCommitAuthor": "bot",
  "updatedDependency": {
    "dependencyGroupID": "com.google.cloud",
    "dependencyArtifactID": "libraries-bom",
    "previousVersion": "22.0.0",
    "newVersion": "23.0.0",
    "dependencyScope": "import",
    "versionUpdateType": "major"
  }
}