{
  "url" : "https://github.com/Doclic/NoEncryption/pull/124",
  "project" : "NoEncryption",
  "breakingCommit" : "9917a52916545aee0ba21958853129037cb7c8c0",
  "prAuthor" : "bot",
  "preCommitAuthor" : "human",
  "breakingCommitAuthor" : "bot",
  "updatedDependency" : {
    "dependencyGroupID" : "io.netty",
    "dependencyArtifactID" : "netty-transport",
    "previousVersion" : "4.1.90.Final",
    "newVersion" : "4.1.95.Final",
    "dependencyScope" : "provided",
    "versionUpdateType" : "other"
  }
}