{
  "url" : "https://github.com/opentripplanner/OpenTripPlanner/pull/4744",
  "project" : "OpenTripPlanner",
  "breakingCommit" : "1df0dc6f9f896d413e7ebc2189c9cf9edcf9d9af",
  "prAuthor" : "bot",
  "preCommitAuthor" : "human",
  "breakingCommitAuthor" : "bot",
  "updatedDependency" : {
    "dependencyGroupID" : "org.processing",
    "dependencyArtifactID" : "core",
    "previousVersion" : "2.2.1",
    "newVersion" : "3.3.7",
    "dependencyScope" : "compile",
    "versionUpdateType" : "major"
  }
}