{
  "url" : "https://github.com/aws/aws-encryption-sdk-java/pull/1562",
  "project" : "aws-encryption-sdk-java",
  "breakingCommit" : "b9b130a3f02b5785acecebf912b8ece320f1d148",
  "prAuthor" : "bot",
  "preCommitAuthor" : "bot",
  "breakingCommitAuthor" : "bot",
  "updatedDependency" : {
    "dependencyGroupID" : "software.amazon.awssdk",
    "dependencyArtifactID" : "kms",
    "previousVersion" : "2.18.38",
    "newVersion" : "2.20.59",
    "dependencyScope" : "compile",
    "versionUpdateType" : "minor"
  }
}