{
  "url" : "https://github.com/matteobaccan/html2pop3/pull/179",
  "project" : "html2pop3",
  "breakingCommit" : "88ded34e2948daf073b2fdf3d7844ee381512ec4",
  "prAuthor" : "bot",
  "preCommitAuthor" : "human",
  "breakingCommitAuthor" : "bot",
  "updatedDependency" : {
    "dependencyGroupID" : "ch.qos.logback",
    "dependencyArtifactID" : "logback-classic",
    "previousVersion" : "1.2.6",
    "newVersion" : "1.2.7",
    "dependencyScope" : "compile",
    "versionUpdateType" : "patch"
  }
}