{
  "url" : "https://github.com/opensrp/opensrp-server-web/pull/850",
  "project" : "opensrp-server-web",
  "breakingCommit" : "034bdcd35e34f74c7c486dbe8e359a4d688c2375",
  "prAuthor" : "bot",
  "preCommitAuthor" : "human",
  "breakingCommitAuthor" : "bot",
  "updatedDependency" : {
    "dependencyGroupID" : "org.hibernate.validator",
    "dependencyArtifactID" : "hibernate-validator",
    "previousVersion" : "6.0.18.Final",
    "newVersion" : "6.0.20.Final",
    "dependencyScope" : "compile",
    "versionUpdateType" : "other"
  }
}